{
  "artifact_gate_model": "openqasm3_1q_pauli_clifford",
  "lean_module": "QSpecBench.Research.CompilerFlagship",
  "lean_theorem": "compiler_generated_artifact_pair_semantically_equivalent",
  "normalization": {
    "hadamard": "unnormalized_int_model"
  },
  "claimed_link": "python_denotation_consistency",
  "gate_set": "openqasm3_1q_pauli_clifford",
  "bridge_evidence_id": "bridge_verify",
  "gate_model": "qspecbench.openqasm3.int_scaffold.v0",
  "qasm_artifact": "artifacts/source.qasm",
  "artifact_sha256": "ef022773134724a54f86931c3e90bebd416e5a0e8ccd30367433d2f59ede40d9",
  "gate_trace_sha256": "d84bdb1127c20f727286a024caef27d228cc25dbde53fa1e85e80763e820f0c1",
  "wire_order": {
    "model": "legacy_kron_order",
    "checked_against": "both"
  }
}
