{
  "artifact_gate_model": "openqasm3_scaffold",
  "lean_module": "QSpecBench.Algorithms",
  "lean_theorem": "grover_diffuser_nontrivial",
  "normalization": {
    "hadamard": "unnormalized_int_model",
    "measurement": "excluded_from_matrix"
  },
  "claimed_link": "documented_not_proved",
  "qasm_artifact": "artifacts/circuit.qasm",
  "gate_model": "qspecbench.openqasm3.int_scaffold.v0",
  "artifact_sha256": "9a9e8ede8f4d69ddce7caac644c1c123be7395ffd68718a563c1b2213702f5d4",
  "gate_trace_sha256": "9f625a9ae4a973b02046c9c9a3754c2cd77974fd6f656da78bebb1bdee417d91",
  "wire_order": {
    "model": "legacy_kron_order",
    "checked_against": "python_operational"
  }
}
