{
  "artifact_gate_model": "openqasm3_complex_unitary",
  "lean_module": "QSpecBench.Quantum.OpenQASM3",
  "lean_theorem": "bridge_toffoli_codegen_ccx",
  "normalization": {
    "ccx": "standard_toffoli_permutation",
    "qasm_factor": "exact_permutation_matrix"
  },
  "claimed_link": "kernel_checked_artifact_semantics",
  "artifact_parse_theorem": "parseQasmSource_toffoli_kernel_eq_generated_ops",
  "qasm_artifact": "artifacts/source.qasm",
  "bridge_evidence_id": "bridge_verify",
  "gate_model": "qspecbench.openqasm3.complex_unitary.v1",
  "artifact_sha256": "d37ec11fdd1ff70e5f8debf1d392b8bad04ac650f57f06a67248da503f665511",
  "gate_trace_sha256": "fb37d6d92ec353d74107dd246c84c0d3750414c0d8041531920f1444b5d359be",
  "ast_sha256": "c0b49ec233d0558ae59549dacd41593a724394a64d9feef218407baa50557795",
  "generated_lean_sha256": "5b20b2248452752eb707da5c515a50912dddebde4bc66e893e3f63b5640c707a",
  "theorem_sha256": "cac696170d47a44d717617f024fb31e44b38cdbd491d79ee9a5c87a9d60aca2d",
  "theorem_identifier_sha256": "cac696170d47a44d717617f024fb31e44b38cdbd491d79ee9a5c87a9d60aca2d",
  "theorem_content_sha256": "1855f4e15c5e2886901262e73b9bcc6336c7a06e84c7e991a3b6a3ae5baf215a",
  "package_lean_sha256": "7f4007e3c454390a4c69274f95a49ae93a7dff1635c8bf0947380be14db46b3a",
  "wire_order": {
    "model": "legacy_kron_order",
    "checked_against": "both"
  },
  "wire_order_bridge_theorem": null,
  "theorem_source_statement_hash": "1855f4e15c5e2886901262e73b9bcc6336c7a06e84c7e991a3b6a3ae5baf215a",
  "theorem_elaborator_hash": "cc4952cf279c0b991de8b051148aaeba742f748f2f8fbd2fddcc8d70db7783a6",
  "lean_ast_sha256": "c0b49ec233d0558ae59549dacd41593a724394a64d9feef218407baa50557795",
  "ast_authority": "lean_mirror",
  "proposition_id": "native_ccx_artifact_denotes_toffoli_unitary_v1",
  "artifact_bound_category": "kernel_checked_codegen_trace"
}
