{
  "artifact_gate_model": "openqasm3_1q_clifford",
  "lean_module": "QSpecBench.Quantum.OpenQASM3",
  "lean_theorem": "bridge_hadamard_codegen_cancel",
  "normalization": {
    "hadamard": "unnormalized_int_model",
    "qasm_factor": "1/sqrt(2) per gate"
  },
  "claimed_link": "kernel_checked_artifact_semantics",
  "artifact_parse_theorem": "parseQasmSource_hh_kernel_eq_generated_ops",
  "gate_model": "qspecbench.openqasm3.int_scaffold.v0",
  "qasm_artifact": "artifacts/source.qasm",
  "artifact_sha256": "0a616794427bddf2144952d60642bd81229975c1017bdffa850721caa0ccab8a",
  "gate_trace_sha256": "cbd175e0734480d649b0768d8698257ab120816947553c7f2b570a840dceab53",
  "ast_sha256": "f731f909a694e3cc30b96260cc4f25a88888e093ef952d7bc9e0cbeb9973d4d9",
  "generated_lean_sha256": "1b2abc850edd8ec2ec695aaabad7ec51b262536586d5f4871648d703920df23e",
  "theorem_sha256": "444609491c695c04095883ccbfb9bf1d5565ef4de94ab4111be3ed1f939750cc",
  "wire_order": {
    "model": "legacy_kron_order",
    "checked_against": "both"
  },
  "theorem_identifier_sha256": "444609491c695c04095883ccbfb9bf1d5565ef4de94ab4111be3ed1f939750cc",
  "theorem_content_sha256": "1a1e5daae2c6f128938cdfd74d1a76920e82681b6cc347f93ce1b806cc8267a0",
  "package_lean_sha256": "9f15ec7c4ee8db125efccbed4619b9f596e24122d92177f18e6c02268c72e452",
  "theorem_source_statement_hash": "1a1e5daae2c6f128938cdfd74d1a76920e82681b6cc347f93ce1b806cc8267a0",
  "theorem_elaborator_hash": "7baa6f6317bee71629f295e1f602e0e5ed06224ae38cae50b48c08855164f720",
  "lean_ast_sha256": "f731f909a694e3cc30b96260cc4f25a88888e093ef952d7bc9e0cbeb9973d4d9",
  "ast_authority": "lean_mirror",
  "proposition_id": "single_qubit_gate_cancellation_v1",
  "artifact_bound_category": "kernel_checked_codegen_trace"
}
