{
  "artifact_gate_model": "openqasm3_complex_unitary",
  "lean_module": "QSpecBench.Algorithms",
  "lean_theorem": "qft_then_inverse_qft_identity",
  "normalization": {
    "qft": "unnormalized_int_model",
    "ordering": "declared_in_notes"
  },
  "claimed_link": "python_denotation_consistency",
  "qasm_artifact": "artifacts/circuit.qasm",
  "bridge_evidence_id": "bridge_verify",
  "gate_model": "qspecbench.openqasm3.complex_unitary.v1",
  "artifact_sha256": "d0f63cc2ee48b0385947548ada10d0a0e3ad83f7bbf0c81280822d67e2a9df5e",
  "gate_trace_sha256": "188cd3a97a12d3c0e98f96aec78b19edf79c45780ab2f37f569840fb9a0ad1f1",
  "wire_order": {
    "model": "legacy_kron_order",
    "checked_against": "python_operational"
  },
  "proposition_id": "qft_then_inverse_qft_identity_up_to_ordering_v1"
}
