{
  "artifact_gate_model": "openqasm3_clifford_t_normalized",
  "lean_module": "QSpecBench.Quantum.OpenQASM3",
  "lean_theorem": "bridge_toffoli_decomposition_normalized_exact",
  "normalization": {
    "hadamard": "hadamardC_normalized",
    "phase_gates": "Complex.exp_T_Tdg_via_CT_algebra",
    "target_circuit": "denotateOps3C_normalized_equals_ccx8C",
    "phase_policy": "exact_equality_global_phase_zero"
  },
  "pair_lean_theorem": "bridge_toffoli_decomposition_normalized_exact",
  "claimed_link": "kernel_checked_artifact_semantics",
  "artifact_parse_theorem": "parseQasmSource_toffoli_kernel_eq_generated_ops",
  "target_artifact_parse_theorem": "parseQasmSource_toffoli_target_kernel_eq_generated_ops",
  "qasm_artifact": "artifacts/source.qasm",
  "target_qasm_artifact": "artifacts/target.qasm",
  "bridge_evidence_id": "bridge_verify",
  "gate_model": "qspecbench.openqasm3.complex_unitary.v1",
  "artifact_sha256": "d37ec11fdd1ff70e5f8debf1d392b8bad04ac650f57f06a67248da503f665511",
  "target_artifact_sha256": "6a3c0d66d83bbe92e0ca8832ceba358aa09f4be4e7d3fc068d80076a11e7a07c",
  "gate_trace_sha256": "fb37d6d92ec353d74107dd246c84c0d3750414c0d8041531920f1444b5d359be",
  "ast_sha256": "c0b49ec233d0558ae59549dacd41593a724394a64d9feef218407baa50557795",
  "lean_ast_sha256": "c0b49ec233d0558ae59549dacd41593a724394a64d9feef218407baa50557795",
  "generated_lean_sha256": "d081179341f6d920f77a537a3c634f46906af642d68d38c34fb6d45a733a4809",
  "theorem_sha256": "490e177553421771aca85d50b38a707fbbce17a903c39d107cafe4923941a4ce",
  "theorem_identifier_sha256": "490e177553421771aca85d50b38a707fbbce17a903c39d107cafe4923941a4ce",
  "theorem_content_sha256": "f00e3bb817902ee291bc017bfa9aad7897faed07dc9f7a26f89f62702a48b100",
  "theorem_source_statement_hash": "f00e3bb817902ee291bc017bfa9aad7897faed07dc9f7a26f89f62702a48b100",
  "theorem_elaborator_hash": "e213fe8f4169874802ed34e5615ae9ab8d75ce1a40810d64d592656979193e74",
  "package_lean_sha256": "7f4007e3c454390a4c69274f95a49ae93a7dff1635c8bf0947380be14db46b3a",
  "wire_order": {
    "model": "openqasm_little_endian_wire_order",
    "checked_against": "lean"
  },
  "wire_order_bridge_theorem": "bridge_toffoli_decomposition_wire_order_lsb",
  "ast_authority": "lean_mirror",
  "proposition_id": "toffoli_decomposition_equivalence_v1",
  "artifact_bound_category": "kernel_checked_codegen_trace"
}
